{
  "$schema": "http://json-schema.org/draft-06/schema",
  "type": "object",
  "properties": {
    "version": {
      "type": "number"
    },
    "success": {
      "type": "boolean"
    },
    "reason": {},
    "content": {
      "type": "object",
      "properties": {
        "id": {
          "type": "string"
        },
        "name": {
          "type": "string"
        },
        "type": {},
        "properties": {
          "type": "object",
          "properties": {
            "definition": {
              "type": "string"
            },
            "description": {
              "type": "string"
            },
            "type": {},
            "parameterSets": {
              "type": "array",
              "items": {
                "type": "object",
                "properties": {
                  "name": {
                    "type": "string"
                  },
                  "parameters": {
                    "type": "array",
                    "items": {
                      "type": "object",
                      "properties": {
                        "name": {
                          "type": "string"
                        },
                        "type": {
                          "type": "string"
                        },
                        "isMandatory": {
                          "type": "boolean"
                        },
                        "isDynamic": {
                          "type": "boolean"
                        },
                        "position": {
                          "type": "integer"
                        },
                        "valueFromPipeline": {
                          "type": "boolean"
                        },
                        "valueFromPipelineByPropertyName": {
                          "type": "boolean"
                        },
                        "valueFromRemainingArguments": {
                          "type": "boolean"
                        },
                        "description": {},
                        "validationSet": {
                          "type": "array"
                        }
                      }
                    }
                  }
                }
              }
            },
            "outputTypes": {
              "type": "array",
              "items": {
                "type": "object",
                "properties": {
                  "name": {
                    "type": "string"
                  },
                  "type": {
                    "type": "string"
                  }
                }
              }
            },
            "creationTime": {
              "type": "string"
            },
            "lastModifiedTime": {
              "type": "string"
            }
          }
        }
      }
    },
    "raw": {},
    "inputs": {
      "type": "object",
      "properties": {
        "activity_name": {
          "type": "string"
        },
        "account_name": {
          "type": "string"
        },
        "resource_group_name": {
          "type": "string"
        },
        "module_name": {
          "type": "string"
        }
      }
    },
    "metrics": {
      "type": "object",
      "properties": {
        "version": {
          "type": "string"
        },
        "package": {
          "type": "string"
        },
        "package_version": {
          "type": "string"
        },
        "host": {
          "type": "string"
        },
        "execution_time_ms": {
          "type": "integer"
        },
        "timestamp": {
          "type": "string"
        }
      }
    }
  }
}