{
  "version": 2.0,
  "success": true,
  "reason": null,
  "content": {
    "task_count_to_salesforce": 1,
    "task_count_to_soar": 0
  },
  "raw": null,
  "inputs": {
    "task_sync_direction": "Salesforce",
    "incident_id": 2199,
    "salesforce_case_id": "500Hr00001Wu3EtIAJ"
  },
  "metrics": {
    "version": "1.0",
    "package": "fn-salesforce",
    "package_version": "1.0.0",
    "host": "MacBook-Pro.local",
    "execution_time_ms": 914,
    "timestamp": "2023-08-08 16:12:06"
  }
}