{
  "version": 2.0,
  "success": true,
  "reason": null,
  "content": {
    "datatables": [
      "email_conversations"
    ],
    "rows": null,
    "incidents": [
      2097
    ]
  },
  "raw": null,
  "inputs": {
    "relations_datatables": "email_conversations",
    "incident_id": 2096,
    "relations_exclude_datatables": "dt_relations_child_incidents"
  },
  "metrics": {
    "version": "1.0",
    "package": "fn-relations",
    "package_version": "3.1.0",
    "host": "localhost",
    "execution_time_ms": 1076,
    "timestamp": "2024-01-17 11:23:17"
  }
}