{
  "version": 2.0,
  "success": true,
  "reason": null,
  "content": {
    "users_dn": [
      "CN=gerry,CN=Users,DC=dev,DC=co3sys,DC=com"
    ],
    "groups_dn": [
      "CN=Charles-3,CN=Users,DC=dev,DC=co3sys,DC=com"
    ]
  },
  "raw": null,
  "inputs": {
    "ldap_domain_name": "Domain2",
    "ldap_multiple_group_dn": "['CN=Charles-3,CN=Users,DC=dev,DC=co3sys,DC=com']",
    "ldap_multiple_user_dn": "['CN=gerry,CN=Users,DC=dev,DC=co3sys,DC=com']"
  },
  "metrics": {
    "version": "1.0",
    "package": "fn-ldap-utilities",
    "package_version": "2.1.0",
    "host": "local",
    "execution_time_ms": 1093,
    "timestamp": "2023-03-30 10:58:09"
  }
}