{
  "version": 2.0,
  "success": true,
  "reason": null,
  "content": {
    "closed": [],
    "skipped": [
      {
        "values": {
          "Request ID": "INC000000000110|INC000000000110",
          "Submitter": "Ian_Agent",
          "Submit Date": "2023-06-22T12:56:30.000+0000",
          "Assignee Login ID": "Sally Agent",
          "Last Modified By": "Ian_Agent",
          "Last Modified Date": "2023-06-22T14:30:49.000+0000",
          "Status": "Resolved",
          "Assignee Groups": "1000000005;'Ian_Agent';",
          "InstanceId": "AGGADOP1EB0FUARWNNYGRWNNYGE04Q",
          "Record ID": "AGGADOP1EB0FUARWNNYGRWNNYGE04Q|AGGADOP1EB0FUARWNNYGRWNNYGE04Q",
          "Vendor Assignee Groups": null,
          "Vendor Assignee Groups_parent": null,
          "Assignee Groups_parent": "",
          "Product Categorization Tier 1": null,
          "Product Categorization Tier 2": null,
          "Product Categorization Tier 3": null,
          "Department": "Customer Service",
          "Site Group": "Amsterdam",
          "Region": "Europe",
          "Product Name": null,
          "Manufacturer": null,
          "Product Model/Version": null,
          "Site": "Amsterdam Support Center",
          "SRAttachment": null,
          "Created_By": null,
          "MaxRetries": null,
          "z1D_Command": null,
          "AccessMode": null,
          "z1D_WorklogDetails": null,
          "z1D_Char02": null,
          "z1D_FormName": null,
          "AppInstanceServer": null,
          "SRInstanceID": "NA",
          "zTmpEventGUID": null,
          "AppInterfaceForm": null,
          "Entry ID": "INC000000000110",
          "z1D_Activity_Type": null,
          "z1D_Summary": null,
          "z1D_Details": null,
          "z1D_Secure_Log": null,
          "z1D_View_Access": null,
          "z2AF_Act_Attachment_1": null,
          "Protocol": null,
          "AppLogin": null,
          "AppPassword": null,
          "PortNumber": null,
          "SRMS Registry Instance ID": "SR0011439CCAD4ec8UQwCkOLAQlQAA",
          "SRMSAOIGuid": null,
          "SRID": null,
          "TemplateID": null,
          "z1D_CommunicationSource": null,
          "z1D_ActivityDate_tab": null,
          "Last _Assigned_Date": null,
          "z1D_AssociationDescription": null,
          "Component_ID": null,
          "mc_ueid": null,
          "cell_name": null,
          "policy_name": null,
          "status_incident": null,
          "status_reason2": null,
          "root_component_id_list": null,
          "root_incident_id_list": null,
          "Impact_OR_Root": null,
          "bOrphanedRoot": null,
          "use_case": null,
          "Needs Attention": null,
          "ClientLocale": null,
          "ServiceCI": null,
          "HPD_CI": null,
          "ServiceCI_ReconID": null,
          "HPD_CI_ReconID": null,
          "z1D_CI_FormName": null,
          "Previous_ServiceCI_ReconID": null,
          "Previous_HPD_CI_ReconID": null,
          "z1D_SR_Instanceid": null,
          "Direct Contact Corporate ID": null,
          "KMSGUID": null,
          "HPD_CI_FormName": null,
          "z1D_InterfaceAction": null,
          "z1D_WorkInfoSubmitter": null,
          "Direct Contact Login ID": null,
          "Customer Login ID": "Ian_Agent",
          "AttachmentSourceFormName": null,
          "AttachmentSourceGUID": null,
          "z1D_ConfirmGroup": null,
          "z1D_CreatedFromBackEndSynchWI": null,
          "InfrastructureEventType": "None",
          "policy_type": null,
          "Chat Session ID": null,
          "Modified Chat Session ID": null,
          "Auto Open Session": null,
          "TimeOfEvent": "2023-06-22T12:56:30.000+0000",
          "FirstWIPDate": null,
          "LastWIPDate": null,
          "Broker Vendor Name": null,
          "NeedsAttentionCCS_Setting": "false",
          "RequestCreatedFromDWP": "No",
          "DWP_SRID": null,
          "DWP_SRInstanceID": null,
          "z1D_COG_AutoSuppGrpPredRule": null,
          "COG_CognSuppGrpComp": null,
          "COG_CognSuppGrpOrg": null,
          "COG_CognSuppGrpName": null,
          "COG_CognSuppGrpID": null,
          "z1D_COG_SuppGrpWorkInfoTag": null,
          "Description": "IBM SOAR Case 2099: Hello World",
          "Company": "Calbro Services",
          "Country": "Netherlands",
          "State Province": "Amsterdam",
          "City": "Schiphol-Rijk",
          "Organization": "Information Technology",
          "Assigned Support Organization": "IT Support",
          "Last Name": "Agent",
          "First Name": "Ian",
          "Middle Initial": null,
          "Contact Client Type": "Office-Based Employee",
          "VIP": "No",
          "Contact Sensitivity": "Standard",
          "Desk Location": null,
          "Mail Station": null,
          "Street": "B Avenue 123",
          "Zip/Postal Code": "1234",
          "Internet E-mail": null,
          "Corporate ID": null,
          "Phone Number": "###",
          "z1D Char01": null,
          "Categorization Tier 1": null,
          "Categorization Tier 2": null,
          "Categorization Tier 3": null,
          "z1D Char02": null,
          "z1D Char03": null,
          "z1D Char04": null,
          "Site ID": "STE_SOLN0002844",
          "z1D Action": null,
          "z1D Integer01": null,
          "Assigned Group ID": "SGP000000000011",
          "Person ID": "PPL000000000118",
          "Contact Company": "Calbro Services",
          "Service Type": "Infrastructure Event",
          "z1D Integer02": null,
          "Status_Reason": "No Further Action Required",
          "Detailed Decription": null,
          "Resolution": "Closed from IBM SOAR",
          "Incident Number": "INC000000000225",
          "Urgency": "2-High",
          "Impact": "3-Moderate/Limited",
          "Priority": "High",
          "Priority Weight": 18,
          "Reported Source": "Systems Management",
          "Assigned Group": "Service Desk",
          "Assignee": "Sally Agent",
          "Assigned Support Company": "Calbro Services",
          "Assigned Group Shift Name": null,
          "Assigned Group Shift ID": null,
          "Owner Support Organization": "IT Support",
          "Number of Attachments": null,
          "Vendor Name": null,
          "Owner Group": "Service Desk",
          "Owner Support Company": "Calbro Services",
          "Owner Group ID": "SGP000000000011",
          "Reported Date": "2023-06-22T12:56:30.000+0000",
          "Responded Date": "2023-06-22T12:56:30.000+0000",
          "Last Acknowledged Date": null,
          "Last Resolved Date": "2023-06-22T14:30:48.000+0000",
          "Closed Date": null,
          "Vendor Ticket Number": null,
          "z1D Permission Group ID": null,
          "z1D Permission Group List": null,
          "z1D Modify All Flag-V": null,
          "Resolution Category": null,
          "Direct Contact Internet E-mail": null,
          "Vendor Organization": null,
          "Vendor Group": null,
          "Vendor Group ID": null,
          "z1D Char27": null,
          "Total Transfers": 1,
          "Resolution Method": null,
          "Resolution Category Tier 2": null,
          "Resolution Category Tier 3": null,
          "Closure Product Category Tier1": null,
          "Closure Product Category Tier2": null,
          "Closure Product Category Tier3": null,
          "Closure Product Name": null,
          "Closure Product Model/Version": null,
          "Closure Manufacturer": null,
          "Estimated Resolution Date": null,
          "Required Resolution DateTime": null,
          "Direct Contact Company": null,
          "Direct Contact Last Name": null,
          "Direct Contact First Name": null,
          "Direct Contact Middle Initial": null,
          "Direct Contact Phone Number": null,
          "Direct Contact Organization": null,
          "Direct Contact Department": null,
          "Direct Contact Region": null,
          "Direct Contact Site Group": null,
          "Direct Contact Site": null,
          "Direct Contact Person ID": null,
          "Direct Contact Street": null,
          "Direct Contact Country": null,
          "Direct Contact State/Province": null,
          "Direct Contact City": null,
          "Direct Contact Zip/Postal Code": null,
          "Direct Contact Time Zone": null,
          "Direct Contact Desk Location": null,
          "Direct Contact Mail Station": null,
          "Direct Contact Location Details": null,
          "Direct Contact Site ID": null,
          "Direct Contact Country Code": null,
          "Direct Contact Area Code": null,
          "Direct Contact Local Number": null,
          "Direct Contact Extension": null
        },
        "_links": {
          "self": [
            {
              "href": "https://bmc.com/api/arsys/v1/entry/HPD:IncidentInterface/INC000000000110%7CINC000000000110"
            }
          ]
        }
      }
    ]
  },
  "raw": null,
  "inputs": {
    "incident_id": 2099,
    "helix_payload": "{\"Status_Reason\": \"Done\"}",
    "bmc_helix_request_id": "INC000000000110|INC000000000110"
  },
  "metrics": {
    "version": "1.0",
    "package": "fn-bmc-helix",
    "package_version": "1.0.0",
    "host": "local",
    "execution_time_ms": 442,
    "timestamp": "2023-06-22 10:31:44"
  }
}