{
  "version": 2.0,
  "success": true,
  "reason": null,
  "content": {
    "success": true
  },
  "raw": null,
  "inputs": {
    "reaqta_hive": "rhiveam",
    "reaqta_endpoint_id": "982370521729466368"
  },
  "metrics": {
    "version": "1.0",
    "package": "fn-reaqta",
    "package_version": "1.1.0",
    "host": "Henry's IBM 16 inch Macbook Pro",
    "execution_time_ms": 1010,
    "timestamp": "2023-07-10 12:46:41"
  }
}