{
  "version": 2.0,
  "success": true,
  "reason": null,
  "content": {
    "result": "success"
  },
  "raw": null,
  "inputs": {
    "extrahop_update_time": 0,
    "extrahop_note": "\nIBM SOAR 10/04/2023 15:36:28\n[SOAR Case - 3080](https://host0.ibm.com:443/#incidents/3080)\nIBM SOAR 10/04/2023 14:00:50\n[SOAR Case - 3390](https://host1.ibm.com:443/#incidents/3390)\nIBM SOAR 2023-04-10 14:18:35\n[SOAR case - '3390'](Closed with resolution summary: 'Not an issue')",
    "extrahop_detection_id": 4294967305
  },
  "metrics": {
    "version": "1.0",
    "package": "fn-extrahop",
    "package_version": "1.0.0",
    "host": "MBP",
    "execution_time_ms": 4470,
    "timestamp": "2023-04-10 14:18:48"
  }
}