{
  "version": 2.0,
  "success": true,
  "reason": null,
  "content": {
    "value": [
      {
        "id": "/subscriptions/abcdefgh-1234-abcd-1234-a1b2c3d4e5f6/resourceGroups/demoassets/providers/Microsoft.Automation/automationAccounts/automation1/schedules/s",
        "name": "s",
        "type": "Microsoft.Automation/AutomationAccounts/Schedules",
        "properties": {
          "description": "",
          "startTime": "2023-08-29T12:05:00-04:00",
          "startTimeOffsetMinutes": -240.0,
          "expiryTime": "2023-08-29T12:05:00-04:00",
          "expiryTimeOffsetMinutes": -240.0,
          "isEnabled": true,
          "nextRun": "2023-08-29T12:05:00-04:00",
          "nextRunOffsetMinutes": -240.0,
          "interval": null,
          "frequency": "OneTime",
          "creationTime": "2023-08-23T16:05:14.3633333+00:00",
          "lastModifiedTime": "2023-08-23T17:09:35.4666667+00:00",
          "timeZone": "America/New_York",
          "advancedSchedule": null
        }
      },
      {
        "id": "/subscriptions/abcdefgh-1234-abcd-1234-a1b2c3d4e5f6/resourceGroups/demoassets/providers/Microsoft.Automation/automationAccounts/automation1/schedules/tester",
        "name": "tester",
        "type": "Microsoft.Automation/AutomationAccounts/Schedules",
        "properties": {
          "description": "",
          "startTime": "2023-08-08T14:35:00-04:00",
          "startTimeOffsetMinutes": -240.0,
          "expiryTime": "2023-08-08T14:35:00-04:00",
          "expiryTimeOffsetMinutes": -240.0,
          "isEnabled": true,
          "nextRun": null,
          "nextRunOffsetMinutes": 0.0,
          "interval": null,
          "frequency": "OneTime",
          "creationTime": "2023-08-08T18:05:08.1333333+00:00",
          "lastModifiedTime": "2023-08-08T18:05:08.1333333+00:00",
          "timeZone": "America/New_York",
          "advancedSchedule": null
        }
      },
      {
        "id": "/subscriptions/abcdefgh-1234-abcd-1234-a1b2c3d4e5f6/resourceGroups/demoassets/providers/Microsoft.Automation/automationAccounts/automation1/schedules/tester1324",
        "name": "tester1324",
        "type": "Microsoft.Automation/AutomationAccounts/Schedules",
        "properties": {
          "description": "something",
          "startTime": "2023-08-25T08:40:00+00:00",
          "startTimeOffsetMinutes": 0.0,
          "expiryTime": "2023-08-25T08:40:00+00:00",
          "expiryTimeOffsetMinutes": 0.0,
          "isEnabled": true,
          "nextRun": "2023-08-25T08:40:00+00:00",
          "nextRunOffsetMinutes": 0.0,
          "interval": null,
          "frequency": "OneTime",
          "creationTime": "2023-08-24T15:31:44.2666667+00:00",
          "lastModifiedTime": "2023-08-24T15:31:44.2666667+00:00",
          "timeZone": "Etc/UTC",
          "advancedSchedule": null
        }
      }
    ]
  },
  "raw": null,
  "inputs": {
    "account_name": "automation1",
    "resource_group_name": "demoassets"
  },
  "metrics": {
    "version": "1.0",
    "package": "fn-azure-automation-utilities",
    "package_version": "1.0.0",
    "host": "local",
    "execution_time_ms": 1400,
    "timestamp": "2023-08-24 11:37:57"
  }
}