{
  "version": 2.0,
  "success": true,
  "reason": null,
  "content": {
    "incidents": [
      2097
    ]
  },
  "raw": null,
  "inputs": {
    "relations_parent_incident_id": 2096
  },
  "metrics": {
    "version": "1.0",
    "package": "fn-relations",
    "package_version": "3.1.0",
    "host": "localhost",
    "execution_time_ms": 2514,
    "timestamp": "2024-01-17 11:32:49"
  }
}