{
  "version": 2.0,
  "success": true,
  "reason": null,
  "content": {
    "salesforce_contact": {
      "attributes": {
        "type": "Contact",
        "url": "/services/data/v58.0/sobjects/Contact/003Hr00002REwc8IAD"
      },
      "Id": "003Hr00002REwc8IAD",
      "IsDeleted": false,
      "MasterRecordId": null,
      "AccountId": null,
      "LastName": "Doe",
      "FirstName": "John",
      "Salutation": "Mr.",
      "Name": "John Doe",
      "OtherStreet": null,
      "OtherCity": null,
      "OtherState": null,
      "OtherPostalCode": null,
      "OtherCountry": null,
      "OtherLatitude": null,
      "OtherLongitude": null,
      "OtherGeocodeAccuracy": null,
      "OtherAddress": null,
      "MailingStreet": null,
      "MailingCity": null,
      "MailingState": null,
      "MailingPostalCode": null,
      "MailingCountry": null,
      "MailingLatitude": null,
      "MailingLongitude": null,
      "MailingGeocodeAccuracy": null,
      "MailingAddress": null,
      "Phone": null,
      "Fax": null,
      "MobilePhone": null,
      "HomePhone": null,
      "OtherPhone": null,
      "AssistantPhone": null,
      "ReportsToId": null,
      "Email": null,
      "Title": null,
      "Department": null,
      "AssistantName": null,
      "LeadSource": null,
      "Birthdate": null,
      "Description": null,
      "OwnerId": "005Hr00000COneZIAT",
      "CreatedDate": "2023-06-16T18:29:41.000+0000",
      "CreatedById": "005Hr00000COneZIAT",
      "LastModifiedDate": "2023-06-16T18:29:41.000+0000",
      "LastModifiedById": "005Hr00000COneZIAT",
      "SystemModstamp": "2023-06-16T18:29:41.000+0000",
      "LastActivityDate": null,
      "LastCURequestDate": null,
      "LastCUUpdateDate": null,
      "LastViewedDate": "2023-07-17T18:58:39.000+0000",
      "LastReferencedDate": "2023-07-17T18:58:39.000+0000",
      "EmailBouncedReason": null,
      "EmailBouncedDate": null,
      "IsEmailBounced": false,
      "PhotoUrl": null,
      "Jigsaw": null,
      "JigsawContactId": null,
      "IndividualId": null,
      "Level__c": null,
      "Languages__c": null
    }
  },
  "raw": null,
  "inputs": {
    "salesforce_contact_id": "003Hr00002REwc8IAD"
  },
  "metrics": {
    "version": "1.0",
    "package": "fn-salesforce",
    "package_version": "1.0.0",
    "host": "MacBook-Pro.local",
    "execution_time_ms": 308,
    "timestamp": "2023-07-17 15:04:52"
  }
}