{
  "version": 2.0,
  "success": true,
  "reason": null,
  "content": {
    "result": [
      {
        "mod_time": 1681647107939,
        "node_id": 1,
        "id": 4294967313,
        "extrahop_id": "~aws.vpc.ntp----",
        "discovery_id": "~aws.vpc.ntp----",
        "display_name": "aws.vpc.ntp",
        "description": null,
        "user_mod_time": 0,
        "discover_time": 1681158480000,
        "vlanid": 0,
        "parent_id": null,
        "macaddr": null,
        "vendor": null,
        "is_l3": false,
        "ipaddr4": null,
        "ipaddr6": null,
        "device_class": "custom",
        "default_name": "Custom ~aws.vpc.ntp----",
        "custom_name": "aws.vpc.ntp",
        "cdp_name": "",
        "dhcp_name": "",
        "netbios_name": "",
        "dns_name": "",
        "custom_type": "",
        "auto_role": "custom",
        "analysis_level": 2,
        "analysis": "advanced",
        "role": "custom",
        "on_watchlist": true,
        "last_seen_time": null,
        "model": null,
        "model_override": null,
        "custom_make": null,
        "custom_model": null,
        "critical": false,
        "custom_criticality": null,
        "cloud_instance_id": null,
        "cloud_instance_type": null,
        "cloud_instance_description": null,
        "cloud_instance_name": null,
        "cloud_account": null,
        "vpc_id": null,
        "subnet_id": null
      },
      {
        "mod_time": 1681752256777,
        "node_id": 1,
        "id": 4294967298,
        "extrahop_id": "0e627f3316130000",
        "discovery_id": "0e627f3316130000",
        "display_name": "db1.i.rx.tours",
        "description": null,
        "user_mod_time": 0,
        "discover_time": 1681158510000,
        "vlanid": 0,
        "parent_id": null,
        "macaddr": "0E:62:7F:33:16:13",
        "vendor": null,
        "is_l3": false,
        "ipaddr4": "10.1.1.7",
        "ipaddr6": null,
        "device_class": "node",
        "default_name": "Device 0e627f3316130000",
        "custom_name": null,
        "cdp_name": "",
        "dhcp_name": "",
        "netbios_name": "",
        "dns_name": "db1.i.rx.tours",
        "custom_type": "",
        "auto_role": "db_server",
        "analysis_level": 2,
        "analysis": "advanced",
        "role": "db_server",
        "on_watchlist": true,
        "last_seen_time": null,
        "model": null,
        "model_override": null,
        "custom_make": null,
        "custom_model": null,
        "critical": false,
        "custom_criticality": null,
        "cloud_instance_id": null,
        "cloud_instance_type": null,
        "cloud_instance_description": null,
        "cloud_instance_name": null,
        "cloud_account": null,
        "vpc_id": null,
        "subnet_id": null
      },
      {
        "mod_time": 1681752406778,
        "node_id": 1,
        "id": 4294967311,
        "extrahop_id": "0e3da802a0b30000",
        "discovery_id": "0e3da802a0b30000",
        "display_name": "pc3",
        "description": null,
        "user_mod_time": 0,
        "discover_time": 1681158480000,
        "vlanid": 0,
        "parent_id": null,
        "macaddr": "0E:3D:A8:02:A0:B3",
        "vendor": null,
        "is_l3": false,
        "ipaddr4": "10.1.0.161",
        "ipaddr6": null,
        "device_class": "node",
        "default_name": "Device 0e3da802a0b30000",
        "custom_name": null,
        "cdp_name": "",
        "dhcp_name": "pc3",
        "netbios_name": "PC3",
        "dns_name": "pc3.i.rx.tours",
        "custom_type": "",
        "auto_role": "pc",
        "analysis_level": 2,
        "analysis": "advanced",
        "role": "pc",
        "on_watchlist": true,
        "last_seen_time": null,
        "model": null,
        "model_override": null,
        "custom_make": null,
        "custom_model": null,
        "critical": false,
        "custom_criticality": null,
        "cloud_instance_id": null,
        "cloud_instance_type": null,
        "cloud_instance_description": null,
        "cloud_instance_name": null,
        "cloud_account": null,
        "vpc_id": null,
        "subnet_id": null
      },
      {
        "mod_time": 1681752437427,
        "node_id": 1,
        "id": 4294967316,
        "extrahop_id": "0e2c7dd42fa50000",
        "discovery_id": "0e2c7dd42fa50000",
        "display_name": "oasis.i.rx.tours",
        "description": null,
        "user_mod_time": 0,
        "discover_time": 1681158720000,
        "vlanid": 0,
        "parent_id": null,
        "macaddr": "0E:2C:7D:D4:2F:A5",
        "vendor": null,
        "is_l3": false,
        "ipaddr4": null,
        "ipaddr6": "2600:1f10:44c7:3304:1bb4:204b:45f3:30a0",
        "device_class": "node",
        "default_name": "Device 0e2c7dd42fa50000",
        "custom_name": null,
        "cdp_name": "",
        "dhcp_name": "",
        "netbios_name": "",
        "dns_name": "oasis.i.rx.tours",
        "custom_type": "",
        "auto_role": "other",
        "analysis_level": 2,
        "analysis": "advanced",
        "role": "other",
        "on_watchlist": true,
        "last_seen_time": null,
        "model": null,
        "model_override": null,
        "custom_make": null,
        "custom_model": null,
        "critical": false,
        "custom_criticality": null,
        "cloud_instance_id": null,
        "cloud_instance_type": null,
        "cloud_instance_description": null,
        "cloud_instance_name": null,
        "cloud_account": null,
        "vpc_id": null,
        "subnet_id": null
      },
      {
        "mod_time": 1681752198592,
        "node_id": 1,
        "id": 4294967296,
        "extrahop_id": "0e3332e223c10000",
        "discovery_id": "0e3332e223c10000",
        "display_name": "jump.i.rx.tours",
        "description": null,
        "user_mod_time": 0,
        "discover_time": 1681158450000,
        "vlanid": 0,
        "parent_id": null,
        "macaddr": "0E:33:32:E2:23:C1",
        "vendor": null,
        "is_l3": false,
        "ipaddr4": null,
        "ipaddr6": "fe80::c33:32ff:fee2:23c1",
        "device_class": "node",
        "default_name": "Device 0e3332e223c10000",
        "custom_name": null,
        "cdp_name": "",
        "dhcp_name": "",
        "netbios_name": "",
        "dns_name": "jump.i.rx.tours",
        "custom_type": "",
        "auto_role": "other",
        "analysis_level": 2,
        "analysis": "advanced",
        "role": "other",
        "on_watchlist": true,
        "last_seen_time": null,
        "model": null,
        "model_override": null,
        "custom_make": null,
        "custom_model": null,
        "critical": false,
        "custom_criticality": null,
        "cloud_instance_id": null,
        "cloud_instance_type": null,
        "cloud_instance_description": null,
        "cloud_instance_name": null,
        "cloud_account": null,
        "vpc_id": null,
        "subnet_id": null
      },
      {
        "mod_time": 1681716728051,
        "node_id": 1,
        "id": 4294967315,
        "extrahop_id": "0e915f41761b0000",
        "discovery_id": "0e915f41761b0000",
        "display_name": "Device 0e915f41761b0000",
        "description": null,
        "user_mod_time": 0,
        "discover_time": 1681158480000,
        "vlanid": 0,
        "parent_id": null,
        "macaddr": "0E:91:5F:41:76:1B",
        "vendor": null,
        "is_l3": false,
        "ipaddr4": "10.1.0.1",
        "ipaddr6": null,
        "device_class": "gateway",
        "default_name": "Device 0e915f41761b0000",
        "custom_name": null,
        "cdp_name": "",
        "dhcp_name": "",
        "netbios_name": "",
        "dns_name": "",
        "custom_type": "",
        "auto_role": "gateway",
        "analysis_level": 2,
        "analysis": "advanced",
        "role": "gateway",
        "on_watchlist": true,
        "last_seen_time": null,
        "model": null,
        "model_override": null,
        "custom_make": null,
        "custom_model": null,
        "critical": false,
        "custom_criticality": null,
        "cloud_instance_id": null,
        "cloud_instance_type": null,
        "cloud_instance_description": null,
        "cloud_instance_name": null,
        "cloud_account": null,
        "vpc_id": null,
        "subnet_id": null
      }
    ]
  },
  "raw": null,
  "inputs": {},
  "metrics": {
    "version": "1.0",
    "package": "fn-extrahop",
    "package_version": "1.0.0",
    "host": "laptop.local",
    "execution_time_ms": 688,
    "timestamp": "2023-04-17 13:27:24"
  }
}