{
  "version": 2.0,
  "success": true,
  "reason": "",
  "content": {
    "@status": "success",
    "@code": "19",
    "result": {
      "@total-count": "1",
      "@count": "1",
      "entry": [
        {
          "@name": "Blocked Group",
          "@location": "vsys",
          "@vsys": "vsys1",
          "static": {
            "member": [
              "1.2.3.4",
              "42.36.75.4",
              "test.com",
              "1.1.1.1"
            ]
          }
        }
      ]
    }
  },
  "raw": null,
  "inputs": {
    "panorama_name_parameter": "Blocked Group",
    "panorama_location": "vsys",
    "panorama_vsys": "vsys1",
    "panorama_label": "panOS"
  },
  "metrics": {
    "version": "1.0",
    "package": "fn-pa-panorama",
    "package_version": "1.5.0",
    "host": "local",
    "execution_time_ms": 3285,
    "timestamp": "2024-08-09 09:01:13"
  }
}