{
  "version": 2.0,
  "success": true,
  "reason": null,
  "content": {
    "message": "Create operation successful.",
    "status": true
  },
  "raw": null,
  "inputs": {
    "splunk_query_param1": "ip",
    "splunk_threat_intel_type": "ip_intel",
    "splunk_label": null,
    "splunk_query_param2": "1.1.1.1"
  },
  "metrics": {
    "version": "1.0",
    "package": "fn-splunk-integration",
    "package_version": "1.4.0",
    "host": "local",
    "execution_time_ms": 1115,
    "timestamp": "2023-08-29 09:40:23"
  }
}