{
  "version": 2.0,
  "success": true,
  "reason": "",
  "content": {
    "status": 200
  },
  "raw": null,
  "inputs": {
    "account_name": "automation1",
    "resource_group_name": "demoassets",
    "schedule_name": "tester1324"
  },
  "metrics": {
    "version": "1.0",
    "package": "fn-azure-automation-utilities",
    "package_version": "1.0.0",
    "host": "local",
    "execution_time_ms": 1244,
    "timestamp": "2023-08-24 11:38:33"
  }
}