{
  "version": 2.0,
  "success": true,
  "reason": null,
  "content": {
    "data_source": "addresses4.csv",
    "rows_added": 6,
    "rows_with_errors": 0
  },
  "raw": null,
  "inputs": {
    "dt_date_time_format": "%m/%d/%y %H:%M",
    "dt_mapping_table": "{\n  \"hdr_number\": \"number\",\n  \"hdr_text\": \"text\",\n  \"hdr_boolean\": \"boolean\",\n  \"hdr_datetime\": \"datetime\",\n  \"hdr_select\": \"select\",\n  \"hdr_multiselect\": \"multi_select\"\n}",
    "incident_id": 2101,
    "attachment_id": 5,
    "dt_datable_name": "dt_utils_test_data_table",
    "dt_has_headers": true
  },
  "metrics": {
    "version": "1.0",
    "package": "fn-datatable-utils",
    "package_version": "2.0.0",
    "host": "AppTestAllen02241.fyre.ibm.com",
    "execution_time_ms": 2456,
    "timestamp": "2023-06-06 01:02:51"
  }
}