{
  "version": 2.0,
  "success": true,
  "reason": null,
  "content": {
    "value": [
      {
        "id": "/subscriptions/a4b7e24a-c7aa-4d84-8dae-89e99b336784/resourceGroups/DemoAssets/providers/Microsoft.Automation/automationAccounts/automation1",
        "location": "eastus",
        "name": "automation1",
        "type": "Microsoft.Automation/AutomationAccounts",
        "tags": {
          "client": "sentinel"
        },
        "properties": {
          "creationTime": "2023-04-28T14:04:03.0766667+00:00",
          "lastModifiedTime": "2023-07-21T14:25:01.7+00:00",
          "publicNetworkAccess": true,
          "disableLocalAuth": false
        },
        "identity": {
          "type": "SystemAssigned",
          "principalId": "5c1a54ee-a043-4852-9b87-ed53005d9c62",
          "tenantId": "50ad7d3e-b889-434d-802d-13b87c68047b"
        }
      },
      {
        "id": "/subscriptions/a4b7e24a-c7aa-4d84-8dae-89e99b336784/resourceGroups/DemoAssets/providers/Microsoft.Automation/automationAccounts/testing352",
        "location": "eastus",
        "name": "testing352",
        "type": "Microsoft.Automation/AutomationAccounts",
        "tags": {},
        "properties": {
          "creationTime": "2023-07-25T12:05:22.16+00:00",
          "lastModifiedTime": "2023-07-25T12:05:22.16+00:00",
          "publicNetworkAccess": true,
          "disableLocalAuth": false
        },
        "identity": {
          "type": "SystemAssigned",
          "principalId": "ee616124-e026-4ca0-8c64-d34bae779faf",
          "tenantId": "50ad7d3e-b889-434d-802d-13b87c68047b"
        }
      },
      {
        "id": "/subscriptions/a4b7e24a-c7aa-4d84-8dae-89e99b336784/resourceGroups/DemoAssets/providers/Microsoft.Automation/automationAccounts/tester183",
        "location": "Canada Central",
        "name": "tester183",
        "type": "Microsoft.Automation/AutomationAccounts",
        "tags": {},
        "properties": {
          "creationTime": "2023-07-25T12:12:11.663+00:00",
          "lastModifiedTime": "2023-07-25T12:12:11.663+00:00",
          "publicNetworkAccess": true,
          "disableLocalAuth": false
        }
      }
    ]
  },
  "raw": null,
  "inputs": {},
  "metrics": {
    "version": "1.0",
    "package": "fn-azure-automation-utilities",
    "package_version": "1.0.0",
    "host": "Richards-MBP-2.hsd1.ma.comcast.net",
    "execution_time_ms": 1200,
    "timestamp": "2023-07-28 12:12:31"
  }
}